{
  "meta": {
    "agent": "project_dashboard_agent",
    "version": "2.0.0",
    "last_updated": "2025-07-29",
    "estimated_tokens": 228,
    "full_md_tokens": 7798,
    "md_file": "agile-ai-agents/ai-agents/project_dashboard_agent.md",
    "file_hash": "f6b5c37f6134d52d4fd9b16889a86038"
  },
  "summary": "## Overview\nThe Project Dashboard Agent specializes in creating and maintaining a dedicated project management web interface that runs separately from the main application. This agent provides real-time visibility into AI agent coordination, document generation, and project progress through an interactive dashboard accessible on its own port.",
  "core_responsibilities": {
    "summary": [
      "**Pre-Built Dashboard Deployment** ‚≠ê READY TO USE",
      "**Real-Time Monitoring & Updates**",
      "**Document Management & Visualization**",
      "**Project Progress Visualization**",
      "**Stakeholder Interaction Interface**",
      "**Agent Coordination Display**"
    ],
    "details_tokens": 734,
    "md_reference": "agile-ai-agents/ai-agents/project_dashboard_agent.md#core-responsibilities"
  },
  "workflows": {
    "available": [
      {
        "name": "Pre-Built Dashboard Deployment Workflow (MODERN AUTO-UPDATE) Workflow",
        "tokens": 0,
        "md_reference": "agile-ai-agents/ai-agents/project_dashboard_agent.md#pre-built-dashboard-deployment-workflow-modern-auto-update-workflow"
      },
      {
        "name": "Real-Time Document Monitoring Workflow",
        "tokens": 0,
        "md_reference": "agile-ai-agents/ai-agents/project_dashboard_agent.md#real-time-document-monitoring-workflow"
      },
      {
        "name": "Stakeholder Decision Management Workflow",
        "tokens": 0,
        "md_reference": "agile-ai-agents/ai-agents/project_dashboard_agent.md#stakeholder-decision-management-workflow"
      },
      {
        "name": "Sprint Progress Visualization Workflow",
        "tokens": 0,
        "md_reference": "agile-ai-agents/ai-agents/project_dashboard_agent.md#sprint-progress-visualization-workflow"
      }
    ],
    "total_tokens": 0,
    "md_reference": "agile-ai-agents/ai-agents/project_dashboard_agent.md#workflows"
  },
  "reference_documentation": {},
  "coordination": {
    "inputs": {},
    "outputs": {},
    "md_reference": "agile-ai-agents/ai-agents/project_dashboard_agent.md#agent-coordination"
  },
  "context_recommendations": {
    "minimal": [
      "meta",
      "summary",
      "core_responsibilities.summary"
    ],
    "standard": [
      "minimal",
      "workflows.available",
      "coordination"
    ],
    "detailed": [
      "standard",
      "reference_documentation",
      "specific_workflow_via_reference"
    ]
  }
}