{
  "meta": {
    "agent": "stakeholder_interview_agent",
    "version": "2.0.0",
    "last_updated": "2025-08-11",
    "estimated_tokens": 30,
    "full_md_tokens": 2956,
    "md_file": "agile-ai-agents/ai-agents/stakeholder_interview_agent.md",
    "file_hash": "21a462e7ebfc19a3882ad30a3958ef6f"
  },
  "summary": "",
  "core_responsibilities": {
    "summary": [],
    "details_tokens": 0,
    "md_reference": "agile-ai-agents/ai-agents/stakeholder_interview_agent.md#core-responsibilities"
  },
  "workflows": {
    "available": [],
    "total_tokens": 0,
    "md_reference": "agile-ai-agents/ai-agents/stakeholder_interview_agent.md#workflows"
  },
  "reference_documentation": {},
  "coordination": {
    "inputs": {},
    "outputs": {},
    "md_reference": "agile-ai-agents/ai-agents/stakeholder_interview_agent.md#agent-coordination"
  },
  "context_recommendations": {
    "minimal": [
      "meta",
      "summary",
      "core_responsibilities.summary"
    ],
    "standard": [
      "minimal",
      "workflows.available",
      "coordination"
    ],
    "detailed": [
      "standard",
      "reference_documentation",
      "specific_workflow_via_reference"
    ]
  }
}